{
  "meta": {
    "title": "Ремонт вместо замены",
    "decision_questions": [
      {"question": "Запускать ли сервис ремонта как отдельное предложение в 2027?", "owner": "Директор по продукту", "decision_date": "2026-11-15"},
      {"question": "Что выносить в коммуникацию — долговечность или цену?", "owner": "Директор по маркетингу", "decision_date": "2026-10-01"}
    ],
    "object": "Потребительские товары длительного пользования",
    "boundaries": "Входит: электроника, одежда, мебель, бытовая техника. Не входит: автомобили, B2B-оборудование",
    "horizon": "2-5",
    "geo": "EU + RU",
    "segments": ["B2C"],
    "depth": "express",
    "wave": 1,
    "weight_profile": "default",
    "lang": "ru",
    "author": "—",
    "date": "2026-09-06",
    "limitations": "УЧЕБНЫЙ НАБОР. Все цифры и ссылки условны, домен example.org выбран намеренно. Файл показывает форму данных и проходимость валидатора, а не содержание: для решений он непригоден. Тема выбрана межотраслевой, чтобы не задавать модели отраслевую калибровку."
  },

  "signals": [
    {
      "id": "sig-001",
      "date_event": "2024-07-30",
      "date_capture": "2026-09-06",
      "headline_fact": "ЕС обязал производителей чинить товары после истечения гарантии",
      "fact": "[F] Директива ЕС о праве на ремонт обязывает производителей ряда категорий товаров выполнять ремонт по запросу потребителя и после истечения гарантийного срока; срок переноса в национальное право — 24 месяца (учебный пример, цифры условны).",
      "source": "Регулятор (учебный пример)",
      "url": "https://example.org/regulation/right-to-repair",
      "doc": {"kind": "pdf", "publisher": "Регулятор (учебный пример)", "title": "Директива о праве на ремонт", "pages": "ст. 5", "retrieved": "2026-09-06"},
      "source_type": "regulation",
      "primacy": "primary",
      "reliability": "A",
      "independent_of": [],
      "geo": "EU",
      "segment": "B2C",
      "steep": "P",
      "cipher": "I",
      "interpretation": "[I] Ремонтопригодность превращается из добровольного обещания бренда в требование к продукту.",
      "alternative": "[I] Норма может остаться формальной: обязанность чинить не равна доступности и цене ремонта.",
      "counter_evidence": "Перенос в национальное право занимает годы, практика правоприменения неизвестна.",
      "ethics": null,
      "novelty": 4,
      "owner": null,
      "next_review": "2027-01",
      "trend_ids": ["tr-1"]
    },
    {
      "id": "sig-002",
      "date_event": "2026-03-11",
      "date_capture": "2026-09-06",
      "headline_fact": "Опрос: 58% готовы починить вещь, если ремонт дешевле трети цены новой",
      "fact": "[F] Исследование потребительского поведения (n=2 100, поле февраль 2026, четыре страны): 58% респондентов выбирают ремонт, если он стоит менее трети цены новой вещи; при цене выше половины доля падает до 12% (учебный пример, цифры условны).",
      "source": "Исследовательская компания (учебный пример)",
      "url": "https://example.org/research/repair-survey-2026",
      "doc": {"kind": "pdf", "publisher": "Исследовательская компания", "title": "Отношение к ремонту, волна 2026", "pages": "с. 14", "retrieved": "2026-09-06"},
      "source_type": "research",
      "primacy": "primary",
      "reliability": "A",
      "independent_of": [],
      "geo": "EU",
      "segment": "B2C",
      "steep": "S",
      "cipher": "P",
      "interpretation": "[I] Готовность чинить упирается не в ценности, а в порог цены — это экономическое, а не идейное решение.",
      "alternative": "[I] Ответы на гипотетический вопрос завышают готовность: реальный выбор делается в момент поломки и под давлением времени.",
      "counter_evidence": "Обвал доли при цене выше половины показывает, что запас прочности у поведения небольшой.",
      "ethics": null,
      "novelty": 2,
      "owner": null,
      "next_review": "2027-03",
      "trend_ids": ["tr-1", "tr-2"]
    },
    {
      "id": "sig-003",
      "date_event": "2026-05-20",
      "date_capture": "2026-09-06",
      "headline_fact": "Продажи запчастей на маркетплейсе выросли на 34% за год",
      "fact": "[F] По данным категорийной аналитики маркетплейса продажи запасных частей и расходников для бытовой техники выросли на 34% год к году при росте категории техники на 6% (учебный пример, цифры условны).",
      "source": "Маркетплейс (учебный пример)",
      "url": "https://example.org/marketplace/category-report",
      "doc": {"kind": "html", "publisher": "Маркетплейс", "title": "Категорийный отчёт", "pages": null, "retrieved": "2026-09-06"},
      "source_type": "marketplace",
      "primacy": "primary",
      "reliability": "B",
      "independent_of": [],
      "geo": "RU",
      "segment": "B2C",
      "steep": "E",
      "cipher": "P",
      "interpretation": "[I] Поведение уже изменилось: люди покупают детали, а не только готовые изделия.",
      "alternative": "[I] Рост может идти от профессиональных мастерских, закупающихся через розничный канал, а не от самих потребителей.",
      "counter_evidence": "Доля запчастей в обороте категории остаётся низкой — база роста маленькая.",
      "ethics": null,
      "novelty": 3,
      "owner": null,
      "next_review": "2026-12",
      "trend_ids": ["tr-1"]
    },
    {
      "id": "sig-004",
      "date_event": "2026-06-02",
      "date_capture": "2026-09-06",
      "headline_fact": "Три производителя открыли собственные сервисы ремонта и trade-in",
      "fact": "[F] За первое полугодие 2026 г. три производителя потребительской электроники объявили о запуске собственных программ ремонта с приёмом старых устройств в зачёт (учебный пример).",
      "source": "Пресс-релизы компаний (учебный пример)",
      "url": "https://example.org/launches/repair-programs",
      "doc": {"kind": "html", "publisher": "Компании", "title": "Пресс-релизы", "pages": null, "retrieved": "2026-09-06"},
      "source_type": "product_launch",
      "primacy": "primary",
      "reliability": "B",
      "independent_of": [],
      "geo": "EU",
      "segment": "B2C",
      "steep": "B",
      "cipher": "P",
      "interpretation": "[I] Производители пытаются возглавить ремонт, чтобы не отдать вторичный рынок независимым мастерским.",
      "alternative": "[I] Программы могут быть подготовкой к регуляторному требованию, а не ответом на спрос.",
      "counter_evidence": "Экономика этих программ не раскрывается: возможно, это маркетинговые витрины без объёма.",
      "ethics": null,
      "novelty": 3,
      "owner": null,
      "next_review": "2026-12",
      "trend_ids": ["tr-1"]
    },
    {
      "id": "sig-005",
      "date_event": "2026-04-15",
      "date_capture": "2026-09-06",
      "headline_fact": "Вакансии мастеров по ремонту электроники: рост в 1,7 раза за год",
      "fact": "[F] Число открытых вакансий с формулировкой «мастер по ремонту электроники» на публичных площадках выросло в 1,7 раза год к году, при этом половина приходится на сети розничной торговли, а не на мастерские (учебный пример).",
      "source": "Агрегатор вакансий (учебный пример)",
      "url": "https://example.org/jobs/repair-technicians",
      "doc": {"kind": "html", "publisher": "Агрегатор вакансий", "title": "Срез вакансий", "pages": null, "retrieved": "2026-09-06"},
      "source_type": "job_posting",
      "primacy": "primary",
      "reliability": "B",
      "independent_of": [],
      "geo": "RU",
      "segment": "—",
      "steep": "B",
      "cipher": "P",
      "interpretation": "[I] Компетенция строится заранее и внутри розницы — обычно опережает публичный запуск на 6–12 месяцев.",
      "alternative": "[I] Возможен эффект переименования существующих ролей или дублирование объявлений между площадками.",
      "counter_evidence": null,
      "ethics": null,
      "novelty": 3,
      "owner": null,
      "next_review": "2026-11",
      "trend_ids": ["tr-1"]
    },
    {
      "id": "sig-006",
      "date_event": "2026-02-08",
      "date_capture": "2026-09-06",
      "headline_fact": "Поисковый спрос на «починить» растёт быстрее, чем на «купить новый»",
      "fact": "[F] Помесячная динамика поисковых запросов по формуле «починить <категория>» показывает рост на 22% год к году против 4% у запросов «купить новый <категория>»; ряд снят с сезонной поправкой по трём годам (учебный пример).",
      "source": "Сервис статистики поисковых запросов (учебный пример)",
      "url": "https://example.org/search/repair-queries",
      "doc": {"kind": "html", "publisher": "Сервис статистики", "title": "Динамика запросов", "pages": null, "retrieved": "2026-09-06"},
      "source_type": "search_query",
      "primacy": "primary",
      "reliability": "B",
      "independent_of": [],
      "geo": "RU",
      "segment": "B2C",
      "steep": "S",
      "cipher": "P",
      "interpretation": "[I] Намерение чинить формируется раньше покупки — поиск фиксирует развилку в момент поломки.",
      "alternative": "[I] Рост может отражать удорожание новых товаров, а не смену отношения к вещам.",
      "counter_evidence": "Поисковый индекс относителен и не переводится в число фактических ремонтов.",
      "ethics": null,
      "novelty": 2,
      "owner": null,
      "next_review": "2026-12",
      "trend_ids": ["tr-1", "tr-2"]
    },
    {
      "id": "sig-007",
      "date_event": "2026-01-19",
      "date_capture": "2026-09-06",
      "headline_fact": "В сообществе мастеров обсуждают невозможность купить детали официально",
      "fact": "[F] В профильном сообществе на 120 тыс. участников тема о недоступности оригинальных запчастей собрала 800 комментариев; преобладает описание обходных практик — разбор доноров и серый импорт (учебный пример).",
      "source": "Профильное сообщество (учебный пример)",
      "url": "https://example.org/forum/parts-availability",
      "doc": {"kind": "html", "publisher": "Сообщество", "title": "Обсуждение", "pages": null, "retrieved": "2026-09-06"},
      "source_type": "forum",
      "primacy": "primary",
      "reliability": "C",